,Startups,"Netherlands, GDP [thousands]","Netherlands, Three month money market rate","Netherlands, Eurostat, HICP, All-Items HICP, 2015=100, Index","Netherlands, OECD Economic Outlook, Hours Worked per Worker, Total Economy, Estimate, Calendar Adjusted, SA","Netherlands, Lending Surveys, Central Bank of Netherlands, Bank Lending Survey, Credit Standards Past 3 Months, Enterprises, Total","Euro Area 19, Long term interest rate","World, Crude Oil, Brent, Spot, FOB North Sea, ICE, Close, USD"
Startups,1.0,0.7178382151293541,0.07073396721547671,0.7055747816581809,-0.4027051257160867,-0.20929113033814564,-0.19371774638914097,-0.07681967431485241
"Netherlands, GDP [thousands]",0.7178382151293541,1.0,-0.14355527596205098,0.9311004335197773,-0.3327680131818037,-0.29262978321344085,-0.4922636760125953,-0.0873871493796295
"Netherlands, Three month money market rate",0.07073396721547671,-0.14355527596205098,1.0,-0.11351473302449987,-0.062387726126155126,0.3286572890854308,0.7920420048929463,0.23925848459634674
"Netherlands, Eurostat, HICP, All-Items HICP, 2015=100, Index",0.7055747816581809,0.9311004335197773,-0.11351473302449987,1.0,-0.4647015631371542,-0.26111005507994456,-0.38859188902200653,0.017324656826687584
"Netherlands, OECD Economic Outlook, Hours Worked per Worker, Total Economy, Estimate, Calendar Adjusted, SA",-0.4027051257160867,-0.3327680131818037,-0.062387726126155126,-0.4647015631371542,1.0,-0.06073568766806272,-0.044728808006749055,-0.26587065378983693
"Netherlands, Lending Surveys, Central Bank of Netherlands, Bank Lending Survey, Credit Standards Past 3 Months, Enterprises, Total",-0.20929113033814564,-0.29262978321344085,0.3286572890854308,-0.26111005507994456,-0.06073568766806272,1.0,0.4091212001354021,0.08766143611715133
"Euro Area 19, Long term interest rate",-0.19371774638914097,-0.4922636760125953,0.7920420048929463,-0.38859188902200653,-0.044728808006749055,0.4091212001354021,1.0,0.5087148356992153
"World, Crude Oil, Brent, Spot, FOB North Sea, ICE, Close, USD",-0.07681967431485241,-0.0873871493796295,0.23925848459634674,0.017324656826687584,-0.26587065378983693,0.08766143611715133,0.5087148356992153,1.0
